{
  "version": "0",
  "title": {
    "en": "One laying hen",
    "ar": "دجاجة بيّاضة واحدة"
  },
  "clock": {
    "day": 0,
    "speed": 10
  },
  "entities": [
    {
      "id": "coop",
      "kind": "coop",
      "name": {
        "en": "Coop",
        "ar": "القنّ"
      },
      "pos": [
        0,
        0,
        0
      ]
    },
    {
      "id": "hen-1",
      "kind": "hen",
      "name": {
        "en": "Hen",
        "ar": "دجاجة"
      },
      "pos": [
        1,
        0,
        0.5
      ],
      "props": {
        "breed": "commercial layer"
      }
    }
  ],
  "flows": [
    {
      "entity": "hen-1",
      "direction": "in",
      "resource": {
        "en": "Feed",
        "ar": "علف"
      },
      "unit": "kg",
      "per_day": 0.118,
      "source": "docs/research A1 [3]: Hy-Line barn layers eat 115-122 g/head/day (midpoint 118.5 g); x 1 head",
      "range": [
        0.115,
        0.122
      ],
      "trust": "web",
      "links": [
        {
          "title": "Hyline commercial (2) | PDF - Slideshare",
          "url": "https://www.slideshare.net/slideshow/hyline-commercial-2/34372256"
        }
      ]
    },
    {
      "entity": "hen-1",
      "direction": "in",
      "resource": {
        "en": "Water",
        "ar": "ماء"
      },
      "unit": "L",
      "per_day": 0.21,
      "source": "docs/research A1 [1,2]: 180-240 mL/head/day at 21 C (midpoint 210 mL), over 600 mL at 38 C; x 1 head",
      "range": [
        0.18,
        0.24
      ],
      "trust": "ai_report"
    },
    {
      "entity": "hen-1",
      "direction": "out",
      "resource": {
        "en": "Eggs",
        "ar": "بيض"
      },
      "unit": "eggs",
      "per_day": 0.816,
      "source": "docs/research A1 [3]: Hy-Line Brown lays 354 eggs to 80 weeks; first egg at 18 weeks [14], so 354 / 434 laying days; range: 354/434 days (to 80 wk) to 315/378 days (to 72 wk); x 1 head",
      "range": [
        0.816,
        0.833
      ],
      "trust": "web",
      "links": [
        {
          "title": "Hyline commercial (2) | PDF - Slideshare",
          "url": "https://www.slideshare.net/slideshow/hyline-commercial-2/34372256"
        }
      ]
    },
    {
      "entity": "hen-1",
      "direction": "out",
      "resource": {
        "en": "Manure",
        "ar": "سماد"
      },
      "unit": "kg",
      "per_day": 0.12,
      "source": "docs/research A1 [2,31]: 110-130 g wet manure/bird/day (midpoint 120 g); x 1 head",
      "range": [
        0.11,
        0.13
      ],
      "trust": "ai_report"
    }
  ]
}
